{
  "schema_version": 1,
  "generated_from": "v3.2.0",
  "server_aliases": [
    {
      "key": "all-installed-servers",
      "alias": "All installed servers",
      "icon": "assets/servers/all-installed-servers.svg"
    },
    {
      "key": "eternal-defiance",
      "alias": "Eternal Defiance",
      "icon": "assets/servers/eternal-defiance.jpg"
    },
    {
      "key": "the-boys",
      "alias": "The Boys™",
      "icon": "assets/servers/the-boys.gif"
    },
    {
      "key": "wednesday-gang",
      "alias": "Wednesday Gang",
      "icon": "assets/servers/wednesday-gang.png"
    }
  ],
  "commands": [
    {
      "path": "Remind Me",
      "name": "Remind Me",
      "category": "Message Interactions",
      "description": "Create a reminder from an existing Discord message.",
      "permission": "user",
      "availability": "Discord servers where Ulfgar Bot is installed",
      "server_keys": [
        "all-installed-servers"
      ],
      "type": "message",
      "options": [],
      "subcommands": [],
      "details": "Open a message’s Apps menu and choose Remind Me to create a one-time reminder."
    },
    {
      "path": "Spoiler",
      "name": "Spoiler",
      "category": "Message Interactions",
      "description": "Repost an existing message with its content hidden as a spoiler.",
      "permission": "user",
      "availability": "The Boys™",
      "server_keys": [
        "the-boys"
      ],
      "type": "message",
      "options": [],
      "subcommands": [],
      "details": "Open a message’s Apps menu, choose Spoiler, and confirm the replacement."
    },
    {
      "path": "birthdays",
      "name": "/birthdays",
      "category": "Birthdays",
      "description": "Manage birthday records and annual guild announcements.",
      "permission": "user",
      "availability": "Eternal Defiance",
      "server_keys": [
        "eternal-defiance"
      ],
      "type": "chat_input",
      "options": [],
      "subcommands": [
        {
          "path": "birthdays/set",
          "name": "/birthdays set",
          "category": "Birthdays",
          "description": "Set or update your birthday and preview the announcement.",
          "permission": "user",
          "availability": "Eternal Defiance",
          "server_keys": [
            "eternal-defiance"
          ],
          "type": "chat_input",
          "options": [
            {
              "name": "date",
              "description": "Birthday in MM-DD format (no year)",
              "type": "string",
              "required": true,
              "min_length": 5,
              "max_length": 5
            },
            {
              "name": "image_url",
              "description": "Optional HTTPS announcement image",
              "type": "string",
              "required": false,
              "max_length": 2048
            },
            {
              "name": "color",
              "description": "Optional six-digit embed color, such as FFD700",
              "type": "string",
              "required": false,
              "min_length": 6,
              "max_length": 7
            }
          ],
          "subcommands": []
        },
        {
          "path": "birthdays/show",
          "name": "/birthdays show",
          "category": "Birthdays",
          "description": "Show your saved birthday and announcement preview.",
          "permission": "user",
          "availability": "Eternal Defiance",
          "server_keys": [
            "eternal-defiance"
          ],
          "type": "chat_input",
          "options": [],
          "subcommands": []
        },
        {
          "path": "birthdays/list",
          "name": "/birthdays list",
          "category": "Birthdays",
          "description": "List registered birthdays for this server.",
          "permission": "user",
          "availability": "Eternal Defiance",
          "server_keys": [
            "eternal-defiance"
          ],
          "type": "chat_input",
          "options": [],
          "subcommands": []
        },
        {
          "path": "birthdays/remove",
          "name": "/birthdays remove",
          "category": "Birthdays",
          "description": "Remove your saved birthday.",
          "permission": "user",
          "availability": "Eternal Defiance",
          "server_keys": [
            "eternal-defiance"
          ],
          "type": "chat_input",
          "options": [],
          "subcommands": []
        },
        {
          "path": "birthdays/help",
          "name": "/birthdays help",
          "category": "Birthdays",
          "description": "View help for birthday commands.",
          "permission": "user",
          "availability": "Eternal Defiance",
          "server_keys": [
            "eternal-defiance"
          ],
          "type": "chat_input",
          "options": [],
          "subcommands": []
        }
      ],
      "details": "Set, preview, inspect, list, or remove month-and-day birthday records without storing birth years."
    },
    {
      "path": "misc",
      "name": "/misc",
      "category": "General",
      "description": "General utility and entertainment commands.",
      "permission": "user",
      "availability": "Selected Discord servers",
      "server_keys": [
        "the-boys",
        "wednesday-gang",
        "eternal-defiance"
      ],
      "type": "chat_input",
      "options": [],
      "subcommands": [
        {
          "path": "misc/changelog",
          "name": "/misc changelog",
          "category": "General",
          "description": "retrieve the bot changelog",
          "permission": "user",
          "availability": "Selected Discord servers",
          "server_keys": [
            "the-boys",
            "wednesday-gang"
          ],
          "type": "chat_input",
          "options": [
            {
              "name": "version",
              "description": "version of the changelog to retrieve",
              "type": "string",
              "required": false
            }
          ],
          "subcommands": []
        },
        {
          "path": "misc/dad_jokes",
          "name": "/misc dad_jokes",
          "category": "General",
          "description": "Get the dad joke scores.",
          "permission": "user",
          "availability": "Selected Discord servers",
          "server_keys": [
            "the-boys",
            "wednesday-gang",
            "eternal-defiance"
          ],
          "type": "chat_input",
          "options": [],
          "subcommands": []
        },
        {
          "path": "misc/quote",
          "name": "/misc quote",
          "category": "General",
          "description": "save a quote for posterity",
          "permission": "user",
          "availability": "Selected Discord servers",
          "server_keys": [
            "the-boys",
            "wednesday-gang"
          ],
          "type": "chat_input",
          "options": [
            {
              "name": "text",
              "description": "text of the quote",
              "type": "string",
              "required": true
            },
            {
              "name": "author",
              "description": "author of the quote",
              "type": "string",
              "required": false
            }
          ],
          "subcommands": []
        },
        {
          "path": "misc/server_icon",
          "name": "/misc server_icon",
          "category": "General",
          "description": "Get the link to today's server icon.",
          "permission": "user",
          "availability": "Selected Discord servers",
          "server_keys": [
            "the-boys",
            "wednesday-gang"
          ],
          "type": "chat_input",
          "options": [],
          "subcommands": []
        },
        {
          "path": "misc/server_banner",
          "name": "/misc server_banner",
          "category": "General",
          "description": "Get the link to today's server banner.",
          "permission": "user",
          "availability": "Selected Discord servers",
          "server_keys": [
            "the-boys",
            "wednesday-gang"
          ],
          "type": "chat_input",
          "options": [],
          "subcommands": []
        },
        {
          "path": "misc/timestamp",
          "name": "/misc timestamp",
          "category": "General",
          "description": "Build a Discord timestamp for a local date and time.",
          "permission": "user",
          "availability": "Selected Discord servers",
          "server_keys": [
            "the-boys",
            "wednesday-gang",
            "eternal-defiance"
          ],
          "type": "chat_input",
          "options": [
            {
              "name": "hour",
              "description": "Local hour",
              "type": "integer",
              "required": true,
              "choices": [
                {
                  "name": "12:00 AM",
                  "value": 0
                },
                {
                  "name": "1:00 AM",
                  "value": 1
                },
                {
                  "name": "2:00 AM",
                  "value": 2
                },
                {
                  "name": "3:00 AM",
                  "value": 3
                },
                {
                  "name": "4:00 AM",
                  "value": 4
                },
                {
                  "name": "5:00 AM",
                  "value": 5
                },
                {
                  "name": "6:00 AM",
                  "value": 6
                },
                {
                  "name": "7:00 AM",
                  "value": 7
                },
                {
                  "name": "8:00 AM",
                  "value": 8
                },
                {
                  "name": "9:00 AM",
                  "value": 9
                },
                {